Type,Name,Description,Ready on,Make URL,n8n URL,Zapier URL,Library page
Workflow,CRM Lead Enrichment on New Contact,"New CRM contact triggers a LinkedIn scrape via Bright Data. Claude extracts title, company and tech stack, updates the CRM and posts a team alert.","Make, n8n",https://www.make.com/en/integration/19003-crm-lead-enrichment-on-new-contact-with-bright-data?templatePublicId=19003,https://n8n.io/workflows/15247-enrich-new-airtable-leads-from-linkedin-using-bright-data-gpt-5-mini-and-slack/,,crm-lead-enrichment.html
Workflow,AI Agent Web Research Loop,"An AI agent browses the web via Bright Data, scrapes multiple pages, summarizes findings, and pushes results to Google Sheets, Notion, Airtable or Slack.","Make, n8n",https://www.make.com/en/integration/19017-ai-agent-web-research-loop-with-bright-data?templatePublicId=19017,https://n8n.io/workflows/15260-research-web-content-with-claude-opus-47-and-bright-data-to-post-slack-reports/,,ai-research-loop.html
Workflow,Website Change Monitor and Alert,"Scheduled fetch of any URL via Bright Data Web Unlocker, compares it to the previous snapshot, Claude summarizes what changed, and fires a Slack or email alert.","Make, n8n",https://www.make.com/en/integration/19067-website-change-monitor-and-alert?templatePublicId=19067,https://n8n.io/workflows/15483-monitor-website-changes-with-bright-data-claude-airtable-and-slack/,,website-change-monitor.html
Workflow,New Job Posting as Outbound Sales Signal,"Bright Data scrapes new LinkedIn job postings, Claude qualifies hiring signals as buying intent, drafts a cold email, creates a CRM deal and pings Slack.","Make, n8n",https://www.make.com/en/integration/19071-new-job-posting-as-outbound-sales-signal-powered-by-bright-data?templatePublicId=19071,https://n8n.io/workflows/15533-track-linkedin-hiring-signals-with-bright-data-openai-airtable-hubspot-and-slack/,,job-signal-outbound.html
Workflow,Automated News Newsletter,"On a schedule, Bright Data searches the web for news, picks the top 5 stories, Claude writes the newsletter as HTML, sent via Beehiiv, ConvertKit, Mailchimp or Gmail.","Make, n8n",https://www.make.com/en/integration/19425-integration-bright-data?templatePublicId=19425,https://n8n.io/workflows/16675-send-weekly-curated-news-newsletters-with-bright-data-claude-and-gmail/,,news-newsletter.html
Workflow,LinkedIn Lead Enrichment & AI Scoring,"A LinkedIn URL in a Google Sheet triggers a Bright Data profile and company scrape, Claude scores the lead 0-100 with a reason, and the row is updated HOT or DONE.","Make, n8n",https://www.make.com/en/integration/19426-bright-data-lead-enrichment-ai-scoring?templatePublicId=19426,https://n8n.io/workflows/16683-score-linkedin-leads-in-google-sheets-with-bright-data-and-claude/,,lead-enrichment-scoring.html
Skill,Competitor Teardown (Bright Data),"Give it one competitor and get an opinionated battlecard built only from Bright Data: what they are building (jobs), what customers hate (reviews), how they position (posts and site).",Claude,,,,skill-competitor-teardown.html
Skill,Ask 3 AIs at Once,"Send one prompt to ChatGPT, Perplexity and Claude in parallel via Bright Data, see all three answers as cards plus a merged best-of.",Claude,,,,skill-ask-3-ais.html
